{
    "$schema": "http://json-schema.org/draft-07/schema#",
    "type": "object",
    "properties": {
        "id": {"type": "number"},
        "identifier": {"type": "string"},
        "persistentUrl": {"type": "string"},
        "protocol": {"type": "string"},
        "authority": {"type": "string"},
        "publisher": {"type": "string"},
        "publicationDate": {"type": "string"},
        "storageIdentifier": {"type": "string"},
        "datasetVersion": {"$ref": "#/definitions/datasetVersion_type"}
    },
    "definitions": {
        "license_type": {
            "type": "object",
            "properties": {
                "name": {"type": "string"},
                "uri": {"type": "string"},
                "iconUri": {"type": "string"}
            }
        },
        "fields_type": {
            "type": "array",
            "minItems": 0,
            "items": {
                "type": "object",
                "properties": {
                    "typeName": {"type": "string"},
                    "multiple": {"type": "boolean"},
                    "typeClass": {"type": "string"},
                    "value": {"type": "string"}
                },
                "required": [
                    "typeName",
                    "multiple",
                    "typeClass",
                    "value"
                ]
            }
        },
        "citation_type": {
            "type": "object",
            "properties": {
                "displayName": {"type": "string"},
                "name": {"type": "string"},
                "fields": {"$ref": "#/definitions/fields_type"}
            }
        },
        "metadataBlocks_type": {
            "type": "object",
            "properties": {
                "citation": {"$ref": "#/definitions/citation_type"}
            }
        },
        "categories_type": {
            "type": "array",
            "minItems": 0,
            "items": {"type": "string"}
        },
        "checksum_type": {
            "type": "object",
            "properties": {
                "type": {"type": "string"},
                "value": {"type": "string"}
            }
        },
        "dataFile_type": {
            "type": "object",
            "properties": {
                "id": {"type": "number"},
                "persistentId": {"type": "string"},
                "filename": {"type": "string"},
                "contentType": {"type": "string"},
                "filesize": {"type": "number"},
                "categories": {"$ref": "#/definitions/categories_type"},
                "storageIdentifier": {"type": "string"},
                "rootDataFileId": {"type": "number"},
                "md5": {"type": "string"},
                "checksum": {"$ref": "#/definitions/checksum_type"},
                "creationDate": {"type": "string"},
                "originalFileFormat": {"type": "string"},
                "originalFormatLabel": {"type": "string"},
                "originalFileSize": {"type": "number"},
                "originalFileName": {"type": "string"},
                "UNF": {"type": "string"}
            }
        },
        "files_type": {
            "type": "array",
            "minItems": 0,
            "items": {
                "type": "object",
                "properties": {
                    "label": {"type": "string"},
                    "restricted": {"type": "boolean"},
                    "version": {"type": "number"},
                    "datasetVersionId": {"type": "number"},
                    "categories": {"$ref": "#/definitions/categories_type"},
                    "dataFile": {"$ref": "#/definitions/dataFile_type"}
                },
                "required": [
                    "restricted",
                    "dataFile",
                    "label",
                    "version",
                    "datasetVersionId"
                ]
            }
        },
        "datasetVersion_type": {
            "type": "object",
            "properties": {
                "id": {"type": "number"},
                "datasetId": {"type": "number"},
                "datasetPersistentId": {"type": "string"},
                "storageIdentifier": {"type": "string"},
                "versionNumber": {"type": "number"},
                "versionMinorNumber": {"type": "number"},
                "versionState": {"type": "string"},
                "lastUpdateTime": {"type": "string"},
                "releaseTime": {"type": "string"},
                "createTime": {"type": "string"},
                "publicationDate": {"type": "string"},
                "citationDate": {"type": "string"},
                "license": {"$ref": "#/definitions/license_type"},
                "termsOfAccess": {"type": "string"},
                "fileAccessRequest": {"type": "boolean"},
                "metadataBlocks": {"$ref": "#/definitions/metadataBlocks_type"},
                "files": {"$ref": "#/definitions/files_type"},
                "citation": {"type": "string"}
            }
        }
    }
}